{
    "componentChunkName": "component---node-modules-gatsby-theme-primer-wiki-src-templates-latest-query-js",
    "path": "/latest/",
    "result": {"data":{"site":{"pathPrefix":"","siteMetadata":{"siteUrl":"https://r0k.wiki"}},"allMdx":{"nodes":[{"frontmatter":{"title":"","draft":false},"fields":{"slug":"/posts/seo/robots.txt/","title":"robots.txt","lastUpdated":"11/13/2022","lastUpdatedAt":"2022-11-13T14:57:43.000Z","gitCreatedAt":"2022-11-13T14:57:43.000Z"}},{"frontmatter":{"title":"","draft":false},"fields":{"slug":"/","title":"ğŸ“ r0k Wiki","lastUpdated":"11/6/2022","lastUpdatedAt":"2022-11-06T07:09:34.000Z","gitCreatedAt":"2021-12-08T16:26:06.000Z"}},{"frontmatter":{"title":"Blob","draft":false},"fields":{"slug":"/Web_API/Blob/","title":"Blob","lastUpdated":"11/6/2022","lastUpdatedAt":"2022-11-06T07:09:34.000Z","gitCreatedAt":"2022-09-17T09:33:37.000Z"}},{"frontmatter":{"title":"DOMMatrixReadOnly","draft":false},"fields":{"slug":"/Web_API/DOMMatrixReadOnly/","title":"DOMMatrixReadOnly","lastUpdated":"11/6/2022","lastUpdatedAt":"2022-11-06T07:09:34.000Z","gitCreatedAt":"2022-06-26T08:04:18.000Z"}},{"frontmatter":{"title":"","draft":false},"fields":{"slug":"/Web_API/íŠ¹ì • í…ìŠ¤íŠ¸ë¥¼ ì°¾ì€ì±„ë¡œ í˜ì´ì§€ ì´ë™í•˜ê¸° with í…ìŠ¤íŠ¸ í”„ë˜ê·¸ë¨¼íŠ¸/","title":"íŠ¹ì • í…ìŠ¤íŠ¸ë¥¼ ì°¾ì€ì±„ë¡œ í˜ì´ì§€ ì´ë™í•˜ê¸° with í…ìŠ¤íŠ¸ í”„ë˜ê·¸ë¨¼íŠ¸","lastUpdated":"9/14/2024","lastUpdatedAt":"2024-09-14T08:53:27.000Z","gitCreatedAt":"2024-05-12T09:22:59.000Z"}},{"frontmatter":{"title":"ë‚´ ê°œë°œ í™˜ê²½ ì„¸íŒ… ê¸°ë¡","draft":false},"fields":{"slug":"/posts/my-setting/","title":"ë‚´ ê°œë°œ í™˜ê²½ ì„¸íŒ… ê¸°ë¡","lastUpdated":"12/18/2022","lastUpdatedAt":"2022-12-18T06:41:00.000Z","gitCreatedAt":"2022-08-10T07:28:06.000Z"}},{"frontmatter":{"title":"callbackë¶€í„° async awaitê¹Œì§€ - Javascript ë¹„ë™ê¸°","draft":false},"fields":{"slug":"/posts/javascript/asynchronous/","title":"callbackë¶€í„° async awaitê¹Œì§€ - Javascript ë¹„ë™ê¸°","lastUpdated":"9/16/2023","lastUpdatedAt":"2023-09-16T09:29:27.000Z","gitCreatedAt":"2023-09-16T09:29:27.000Z"}},{"frontmatter":{"title":"","draft":false},"fields":{"slug":"/posts/error/ëª¨ë…¸ë ˆí¬ì—ì„œ ì„œë¡œ ë‹¤ë¥¸ react ë²„ì „ ì‚¬ìš©ì‹œ ì—ëŸ¬/","title":"ëª¨ë…¸ë ˆí¬ì—ì„œ ì„œë¡œ ë‹¤ë¥¸ React ë²„ì „ ì‚¬ìš©ì‹œ ì—ëŸ¬","lastUpdated":"5/5/2024","lastUpdatedAt":"2024-05-05T08:20:59.000Z","gitCreatedAt":"2024-05-05T08:20:59.000Z"}},{"frontmatter":{"title":"ìë°”ìŠ¤í¬ë¦½íŠ¸ ë°ë“œ ì½”ë“œ ì œê±°","draft":false},"fields":{"slug":"/posts/javascript/ìë°”ìŠ¤í¬ë¦½íŠ¸ ë°ë“œ ì½”ë“œ ì œê±°/","title":"ìë°”ìŠ¤í¬ë¦½íŠ¸ ë°ë“œ ì½”ë“œ ì œê±°","lastUpdated":"3/17/2024","lastUpdatedAt":"2024-03-17T06:05:50.000Z","gitCreatedAt":"2023-10-14T09:10:57.000Z"}},{"frontmatter":{"title":"ì›¹íŒ©ì„ ì“°ëŠ” ì´ìœ ì™€ ì‚¬ìš©ë²• ì •ë¦¬","draft":false},"fields":{"slug":"/posts/javascript/webpack/","title":"ì›¹íŒ©ì„ ì“°ëŠ” ì´ìœ ì™€ ì‚¬ìš©ë²• ì •ë¦¬","lastUpdated":"3/17/2024","lastUpdatedAt":"2024-03-17T06:05:50.000Z","gitCreatedAt":"2023-09-16T09:29:27.000Z"}},{"frontmatter":{"title":"í”„ë¡ íŠ¸ì—”ë“œ ì„±ëŠ¥ ìµœì í™” íŒ ê¸°ë¡","draft":false},"fields":{"slug":"/posts/frontend/performance-tip/","title":"í”„ë¡ íŠ¸ì—”ë“œ ì„±ëŠ¥ ìµœì í™” íŒ ê¸°ë¡","lastUpdated":"1/1/2024","lastUpdatedAt":"2024-01-01T09:36:44.000Z","gitCreatedAt":"2024-01-01T09:36:44.000Z"}},{"frontmatter":{"title":"eslintì—ì„œ biomeë¡œ","draft":false},"fields":{"slug":"/posts/library/biome/","title":"eslintì—ì„œ biomeë¡œ","lastUpdated":"9/14/2024","lastUpdatedAt":"2024-09-14T08:53:27.000Z","gitCreatedAt":"2024-09-14T08:53:27.000Z"}},{"frontmatter":{"title":"Sentry","draft":false},"fields":{"slug":"/posts/monitoring/sentry/","title":"Sentry","lastUpdated":"5/1/2023","lastUpdatedAt":"2023-05-01T07:26:41.000Z","gitCreatedAt":"2022-11-07T15:20:28.000Z"}},{"frontmatter":{"title":"ì •ê·œí‘œí˜„ì‹ - 01. ì…ë¬¸ ì •ê·œí‘œí˜„ì‹","draft":false},"fields":{"slug":"/posts/regex/regex_01/","title":"ì •ê·œí‘œí˜„ì‹ - 01. ì…ë¬¸ ì •ê·œí‘œí˜„ì‹","lastUpdated":"11/6/2022","lastUpdatedAt":"2022-11-06T07:09:34.000Z","gitCreatedAt":"2022-03-27T07:40:34.000Z"}},{"frontmatter":{"title":"ì •ê·œí‘œí˜„ì‹ - 03. í”„ë¡œê·¸ë˜ë¨¸ë¥¼ ìœ„í•œ ê³ ê¸‰ ì •ê·œí‘œí˜„ì‹","draft":false},"fields":{"slug":"/posts/regex/regex_03/","title":"ì •ê·œí‘œí˜„ì‹ - 03. í”„ë¡œê·¸ë˜ë¨¸ë¥¼ ìœ„í•œ ê³ ê¸‰ ì •ê·œí‘œí˜„ì‹","lastUpdated":"11/6/2022","lastUpdatedAt":"2022-11-06T07:09:34.000Z","gitCreatedAt":"2022-03-27T07:40:34.000Z"}},{"frontmatter":{"title":"ì •ê·œí‘œí˜„ì‹ - 02. ì •ê·œí‘œí˜„ì‹ì˜ ì—­ì‚¬","draft":false},"fields":{"slug":"/posts/regex/regex_02/","title":"ì •ê·œí‘œí˜„ì‹ - 02. ì •ê·œí‘œí˜„ì‹ì˜ ì—­ì‚¬","lastUpdated":"11/6/2022","lastUpdatedAt":"2022-11-06T07:09:34.000Z","gitCreatedAt":"2022-03-19T10:17:58.000Z"}},{"frontmatter":{"title":"ì •ê·œì–¸ì–´","draft":false},"fields":{"slug":"/posts/regex/regular-language/","title":"ì •ê·œì–¸ì–´","lastUpdated":"11/7/2022","lastUpdatedAt":"2022-11-07T04:49:59.000Z","gitCreatedAt":"2022-11-07T04:49:59.000Z"}},{"frontmatter":{"title":"next.js SEO ê°œì„ í•˜ê¸°","draft":true},"fields":{"slug":"/posts/seo/nextjs dynamic sitemap/","title":"next.js SEO ê°œì„ í•˜ê¸°","lastUpdated":"9/16/2023","lastUpdatedAt":"2023-09-16T09:29:27.000Z","gitCreatedAt":"2022-11-13T14:57:43.000Z"}},{"frontmatter":{"title":"í˜¼ì ì•Œê¸° ì•„ê¹Œìš´ chatgpt í™œìš© ê¿€íŒ","draft":false},"fields":{"slug":"/posts/tip/chatgpt/","title":"í˜¼ì ì•Œê¸° ì•„ê¹Œìš´ chatgpt í™œìš© ê¿€íŒ","lastUpdated":"5/1/2023","lastUpdatedAt":"2023-05-01T07:34:13.000Z","gitCreatedAt":"2023-05-01T07:34:13.000Z"}},{"frontmatter":{"title":"ë‚´ê°€ ì¨ë¨¹ìœ¼ë ¤ê³  ì •ë¦¬í•œ ë‹¨ì¶•í‚¤ & ëª…ë ¹ì–´ ëª¨ìŒ","draft":false},"fields":{"slug":"/posts/tip/shortcut/","title":"ë‚´ê°€ ì¨ë¨¹ìœ¼ë ¤ê³  ì •ë¦¬í•œ ë‹¨ì¶•í‚¤ & ëª…ë ¹ì–´ ëª¨ìŒ","lastUpdated":"3/17/2024","lastUpdatedAt":"2024-03-17T06:05:50.000Z","gitCreatedAt":"2021-12-21T13:32:24.000Z"}},{"frontmatter":{"title":"webstorm ì‚¬ìš© íŒ","draft":false},"fields":{"slug":"/posts/tip/webstorm/","title":"webstorm ì‚¬ìš© íŒ","lastUpdated":"3/17/2024","lastUpdatedAt":"2024-03-17T06:05:50.000Z","gitCreatedAt":"2022-03-19T10:18:29.000Z"}},{"frontmatter":{"title":"ë‚˜ë§Œì˜ ì—…ë¬´ ìŠµê´€ ì •ë¦¬","draft":false},"fields":{"slug":"/posts/tip/ë‚˜ë§Œì˜ ì—…ë¬´ ìŠµê´€ ì •ë¦¬/","title":"ë‚˜ë§Œì˜ ì—…ë¬´ ìŠµê´€ ì •ë¦¬","lastUpdated":"3/17/2024","lastUpdatedAt":"2024-03-17T06:05:50.000Z","gitCreatedAt":"2024-01-18T14:58:18.000Z"}},{"frontmatter":{"title":"","draft":false},"fields":{"slug":"/posts/tip/ë ˆê±°ì‹œë¥¼ ë” ë‚˜ì€ í™˜ê²½ìœ¼ë¡œ ë§Œë“¤ê¸°/","title":"ë ˆê±°ì‹œë¥¼ ë” ë‚˜ì€ í™˜ê²½ìœ¼ë¡œ ë§Œë“¤ê¸°","lastUpdated":"2/25/2024","lastUpdatedAt":"2024-02-25T04:17:31.000Z","gitCreatedAt":"2024-02-11T11:10:50.000Z"}},{"frontmatter":{"title":"í‚¤ë³´ë“œ ì•ˆì“°ê¸°","draft":false},"fields":{"slug":"/posts/tip/í‚¤ë³´ë“œ ì•ˆì“°ê¸°/","title":"í‚¤ë³´ë“œ ì•ˆì“°ê¸°","lastUpdated":"1/18/2024","lastUpdatedAt":"2024-01-18T14:58:18.000Z","gitCreatedAt":"2024-01-16T14:57:49.000Z"}},{"frontmatter":{"title":"ì›¹ì—ì„œ\bì˜ìƒ ì¬ìƒì„ í•˜ê¸° ìœ„í•œ ì£¼ë³€ ì§€ì‹","draft":false},"fields":{"slug":"/posts/web/video player/","title":"ì›¹ì—ì„œ\bì˜ìƒ ì¬ìƒì„ í•˜ê¸° ìœ„í•œ ì£¼ë³€ ì§€ì‹","lastUpdated":"4/20/2024","lastUpdatedAt":"2024-04-20T07:06:51.000Z","gitCreatedAt":"2024-04-10T02:21:41.000Z"}},{"frontmatter":{"title":"","draft":false},"fields":{"slug":"/posts/books/object/ì˜¤ë¸Œì íŠ¸-00/","title":"ì˜¤ë¸Œì íŠ¸-00","lastUpdated":"11/22/2022","lastUpdatedAt":"2022-11-22T07:55:59.000Z","gitCreatedAt":"2022-11-22T07:55:59.000Z"}},{"frontmatter":{"title":"ì˜¤íŠ¸ì íŠ¸ 01 ê°ì²´, ì„¤ê³„","draft":false},"fields":{"slug":"/posts/books/object/ì˜¤ë¸Œì íŠ¸-01/","title":"ì˜¤íŠ¸ì íŠ¸ 01 ê°ì²´, ì„¤ê³„","lastUpdated":"11/22/2022","lastUpdatedAt":"2022-11-22T07:55:59.000Z","gitCreatedAt":"2022-11-22T07:55:59.000Z"}},{"frontmatter":{"title":"ì˜¤íŠ¸ì íŠ¸ 03 ì—­í• , ì±…ì„, í˜‘ë ¥","draft":false},"fields":{"slug":"/posts/books/object/ì˜¤ë¸Œì íŠ¸-03/","title":"ì˜¤íŠ¸ì íŠ¸ 03 ì—­í• , ì±…ì„, í˜‘ë ¥","lastUpdated":"11/22/2022","lastUpdatedAt":"2022-11-22T07:55:59.000Z","gitCreatedAt":"2022-11-22T07:55:59.000Z"}},{"frontmatter":{"title":"ì˜¤íŠ¸ì íŠ¸ 04 ì„¤ê³„ í’ˆì§ˆê³¼ íŠ¸ë ˆì´ë“œ ì˜¤í”„","draft":false},"fields":{"slug":"/posts/books/object/ì˜¤ë¸Œì íŠ¸-04/","title":"ì˜¤íŠ¸ì íŠ¸ 04 ì„¤ê³„ í’ˆì§ˆê³¼ íŠ¸ë ˆì´ë“œ ì˜¤í”„","lastUpdated":"11/22/2022","lastUpdatedAt":"2022-11-22T07:55:59.000Z","gitCreatedAt":"2022-11-22T07:55:59.000Z"}},{"frontmatter":{"title":"ì˜¤íŠ¸ì íŠ¸ 06 ë©”ì‹œì§€ì™€ ì¸í„°í˜ì´ìŠ¤","draft":false},"fields":{"slug":"/posts/books/object/ì˜¤ë¸Œì íŠ¸-06/","title":"ì˜¤íŠ¸ì íŠ¸ 06 ë©”ì‹œì§€ì™€ ì¸í„°í˜ì´ìŠ¤","lastUpdated":"11/22/2022","lastUpdatedAt":"2022-11-22T07:55:59.000Z","gitCreatedAt":"2022-11-22T07:55:59.000Z"}},{"frontmatter":{"title":"ì˜¤íŠ¸ì íŠ¸ 05 ì±…ì„ í• ë‹¹í•˜ê¸°","draft":false},"fields":{"slug":"/posts/books/object/ì˜¤ë¸Œì íŠ¸-05/","title":"ì˜¤íŠ¸ì íŠ¸ 05 ì±…ì„ í• ë‹¹í•˜ê¸°","lastUpdated":"11/22/2022","lastUpdatedAt":"2022-11-22T07:55:59.000Z","gitCreatedAt":"2022-11-22T07:55:59.000Z"}},{"frontmatter":{"title":"ì˜¤íŠ¸ì íŠ¸ 02 ê°ì²´ì§€í–¥ í”„ë¡œê·¸ë˜ë°","draft":false},"fields":{"slug":"/posts/books/object/ì˜¤ë¸Œì íŠ¸-02/","title":"ì˜¤íŠ¸ì íŠ¸ 02 ê°ì²´ì§€í–¥ í”„ë¡œê·¸ë˜ë°","lastUpdated":"11/22/2022","lastUpdatedAt":"2022-11-22T07:55:59.000Z","gitCreatedAt":"2022-11-22T07:55:59.000Z"}},{"frontmatter":{"title":"github ë¸”ë¡œê·¸ì— ë„ë©”ì¸ ì—°ê²°í•˜ê¸° by cloudflare","draft":false},"fields":{"slug":"/posts/cloud/cloudflare/my-dns/","title":"github ë¸”ë¡œê·¸ì— ë„ë©”ì¸ ì—°ê²°í•˜ê¸° by cloudflare","lastUpdated":"11/19/2022","lastUpdatedAt":"2022-11-19T05:03:07.000Z","gitCreatedAt":"2022-10-29T10:25:02.000Z"}},{"frontmatter":{"title":"react-query ë™ì‘ ì•ˆí•˜ëŠ” ì´ìŠˆ í•´ê²°","draft":false},"fields":{"slug":"/posts/library/react-query/fail-request/","title":"react-query ë™ì‘ ì•ˆí•˜ëŠ” ì´ìŠˆ í•´ê²°","lastUpdated":"9/28/2024","lastUpdatedAt":"2024-09-28T12:49:58.000Z","gitCreatedAt":"2024-09-28T09:12:22.000Z"}},{"frontmatter":{"title":"","draft":false},"fields":{"slug":"/posts/library/shaka-player/shaka-player tip/","title":"ì—ëŸ¬ ëª¨ë‹ˆí„°ë§","lastUpdated":"5/12/2024","lastUpdatedAt":"2024-05-12T09:22:59.000Z","gitCreatedAt":"2024-04-10T02:21:41.000Z"}},{"frontmatter":{"title":"git ë”¥ë‹¤ì´ë¸Œ - git merge, rebase","draft":false},"fields":{"slug":"/posts/study/codesoom-git/git-deep-dive-02/","title":"git ë”¥ë‹¤ì´ë¸Œ - git merge, rebase","lastUpdated":"11/6/2022","lastUpdatedAt":"2022-11-06T07:09:34.000Z","gitCreatedAt":"2022-09-24T09:30:11.000Z"}},{"frontmatter":{"title":"git ë”¥ë‹¤ì´ë¸Œ - git branch, tag, HEAD","draft":false},"fields":{"slug":"/posts/study/codesoom-git/git-deep-dive-01/","title":"git ë”¥ë‹¤ì´ë¸Œ - git branch, tag, HEAD","lastUpdated":"11/6/2022","lastUpdatedAt":"2022-11-06T07:09:34.000Z","gitCreatedAt":"2022-09-17T09:33:37.000Z"}},{"frontmatter":{"title":"git ë”¥ë‹¤ì´ë¸Œ - history","draft":false},"fields":{"slug":"/posts/study/codesoom-git/git-deep-dive-03/","title":"git ë”¥ë‹¤ì´ë¸Œ - history","lastUpdated":"11/6/2022","lastUpdatedAt":"2022-11-06T07:09:34.000Z","gitCreatedAt":"2022-10-02T08:25:42.000Z"}},{"frontmatter":{"title":"This Is a Placeholder File for Mdx","draft":true},"fields":{"slug":"/placeholder/","title":"This Is a Placeholder File for Mdx","lastUpdated":"","lastUpdatedAt":"","gitCreatedAt":""}}]}},"pageContext":{"slug":"/latest/","sidebarItems":[{"title":"","items":[{"title":"Recently Updated","url":"/latest/","collapse":true,"indent":false,"items":[{"title":"09-28: react-query ë™ì‘ ì•ˆí•˜ëŠ” ì´ìŠˆ í•´ê²°","url":"/posts/library/react-query/fail-request/"},{"title":"09-14: íŠ¹ì • í…ìŠ¤íŠ¸ë¥¼ ì°¾ì€ì±„ë¡œ í˜ì´ì§€ ì´ë™í•˜ê¸° with í…ìŠ¤íŠ¸ í”„ë˜ê·¸ë¨¼íŠ¸","url":"/Web_API/íŠ¹ì • í…ìŠ¤íŠ¸ë¥¼ ì°¾ì€ì±„ë¡œ í˜ì´ì§€ ì´ë™í•˜ê¸° with í…ìŠ¤íŠ¸ í”„ë˜ê·¸ë¨¼íŠ¸/"},{"title":"09-14: eslintì—ì„œ biomeë¡œ","url":"/posts/library/biome/"},{"title":"05-12: ì—ëŸ¬ ëª¨ë‹ˆí„°ë§","url":"/posts/library/shaka-player/shaka-player tip/"},{"title":"05-05: ëª¨ë…¸ë ˆí¬ì—ì„œ ì„œë¡œ ë‹¤ë¥¸ React ë²„ì „ ì‚¬ìš©ì‹œ ì—ëŸ¬","url":"/posts/error/ëª¨ë…¸ë ˆí¬ì—ì„œ ì„œë¡œ ë‹¤ë¥¸ react ë²„ì „ ì‚¬ìš©ì‹œ ì—ëŸ¬/"},{"title":"04-20: ì›¹ì—ì„œ\bì˜ìƒ ì¬ìƒì„ í•˜ê¸° ìœ„í•œ ì£¼ë³€ ì§€ì‹","url":"/posts/web/video player/"},{"title":"03-17: ìë°”ìŠ¤í¬ë¦½íŠ¸ ë°ë“œ ì½”ë“œ ì œê±°","url":"/posts/javascript/ìë°”ìŠ¤í¬ë¦½íŠ¸ ë°ë“œ ì½”ë“œ ì œê±°/"},{"title":"03-17: ì›¹íŒ©ì„ ì“°ëŠ” ì´ìœ ì™€ ì‚¬ìš©ë²• ì •ë¦¬","url":"/posts/javascript/webpack/"},{"title":"03-17: ë‚´ê°€ ì¨ë¨¹ìœ¼ë ¤ê³  ì •ë¦¬í•œ ë‹¨ì¶•í‚¤ & ëª…ë ¹ì–´ ëª¨ìŒ","url":"/posts/tip/shortcut/"},{"title":"03-17: webstorm ì‚¬ìš© íŒ","url":"/posts/tip/webstorm/"}]}]},{"title":"Tags","items":[{"title":"Readme","type":"tag","url":"/tags/readme/","items":[{"title":"ğŸ“ r0k Wiki","url":"/"}]},{"title":"Sentry","type":"tag","url":"/tags/sentry/","items":[{"title":"Sentry","url":"/posts/monitoring/sentry/"}]},{"title":"Web API","type":"tag","url":"/tags/web-api/","items":[{"title":"Blob","url":"/Web_API/Blob/"},{"title":"DOMMatrixReadOnly","url":"/Web_API/DOMMatrixReadOnly/"}]},{"title":"chatgpt","type":"tag","url":"/tags/chatgpt/","items":[{"title":"í˜¼ì ì•Œê¸° ì•„ê¹Œìš´ chatgpt í™œìš© ê¿€íŒ","url":"/posts/tip/chatgpt/"}]},{"title":"cloudflare","type":"tag","url":"/tags/cloudflare/","items":[{"title":"github ë¸”ë¡œê·¸ì— ë„ë©”ì¸ ì—°ê²°í•˜ê¸° by cloudflare","url":"/posts/cloud/cloudflare/my-dns/"}]},{"title":"git","type":"tag","url":"/tags/git/","items":[{"title":"git ë”¥ë‹¤ì´ë¸Œ - git merge, rebase","url":"/posts/study/codesoom-git/git-deep-dive-02/"},{"title":"git ë”¥ë‹¤ì´ë¸Œ - git branch, tag, HEAD","url":"/posts/study/codesoom-git/git-deep-dive-01/"},{"title":"git ë”¥ë‹¤ì´ë¸Œ - history","url":"/posts/study/codesoom-git/git-deep-dive-03/"}]},{"title":"javascript","type":"tag","url":"/tags/javascript/","items":[{"title":"callbackë¶€í„° async awaitê¹Œì§€ - Javascript ë¹„ë™ê¸°","url":"/posts/javascript/asynchronous/"},{"title":"ìë°”ìŠ¤í¬ë¦½íŠ¸ ë°ë“œ ì½”ë“œ ì œê±°","url":"/posts/javascript/ìë°”ìŠ¤í¬ë¦½íŠ¸ ë°ë“œ ì½”ë“œ ì œê±°/"},{"title":"ì›¹íŒ©ì„ ì“°ëŠ” ì´ìœ ì™€ ì‚¬ìš©ë²• ì •ë¦¬","url":"/posts/javascript/webpack/"},{"title":"í”„ë¡ íŠ¸ì—”ë“œ ì„±ëŠ¥ ìµœì í™” íŒ ê¸°ë¡","url":"/posts/frontend/performance-tip/"},{"title":"ì›¹ì—ì„œ\bì˜ìƒ ì¬ìƒì„ í•˜ê¸° ìœ„í•œ ì£¼ë³€ ì§€ì‹","url":"/posts/web/video player/"}]},{"title":"my-setting","type":"tag","url":"/tags/my-setting/","items":[{"title":"ë‚´ ê°œë°œ í™˜ê²½ ì„¸íŒ… ê¸°ë¡","url":"/posts/my-setting/"}]},{"title":"react-query","type":"tag","url":"/tags/react-query/","items":[{"title":"react-query ë™ì‘ ì•ˆí•˜ëŠ” ì´ìŠˆ í•´ê²°","url":"/posts/library/react-query/fail-request/"}]},{"title":"tip","type":"tag","url":"/tags/tip/","items":[{"title":"ë‚´ê°€ ì¨ë¨¹ìœ¼ë ¤ê³  ì •ë¦¬í•œ ë‹¨ì¶•í‚¤ & ëª…ë ¹ì–´ ëª¨ìŒ","url":"/posts/tip/shortcut/"},{"title":"webstorm ì‚¬ìš© íŒ","url":"/posts/tip/webstorm/"},{"title":"ë‚˜ë§Œì˜ ì—…ë¬´ ìŠµê´€ ì •ë¦¬","url":"/posts/tip/ë‚˜ë§Œì˜ ì—…ë¬´ ìŠµê´€ ì •ë¦¬/"},{"title":"í‚¤ë³´ë“œ ì•ˆì“°ê¸°","url":"/posts/tip/í‚¤ë³´ë“œ ì•ˆì“°ê¸°/"}]},{"title":"webstorm","type":"tag","url":"/tags/webstorm/","items":[{"title":"webstorm ì‚¬ìš© íŒ","url":"/posts/tip/webstorm/"}]},{"title":"ê°œì„ ","type":"tag","url":"/tags/ê°œì„ /","items":[{"title":"ìë°”ìŠ¤í¬ë¦½íŠ¸ ë°ë“œ ì½”ë“œ ì œê±°","url":"/posts/javascript/ìë°”ìŠ¤í¬ë¦½íŠ¸ ë°ë“œ ì½”ë“œ ì œê±°/"},{"title":"eslintì—ì„œ biomeë¡œ","url":"/posts/library/biome/"},{"title":"ë ˆê±°ì‹œë¥¼ ë” ë‚˜ì€ í™˜ê²½ìœ¼ë¡œ ë§Œë“¤ê¸°","url":"/posts/tip/ë ˆê±°ì‹œë¥¼ ë” ë‚˜ì€ í™˜ê²½ìœ¼ë¡œ ë§Œë“¤ê¸°/"}]},{"title":"ë‹¨ì¶•í‚¤","type":"tag","url":"/tags/ë‹¨ì¶•í‚¤/","items":[{"title":"ë‚´ê°€ ì¨ë¨¹ìœ¼ë ¤ê³  ì •ë¦¬í•œ ë‹¨ì¶•í‚¤ & ëª…ë ¹ì–´ ëª¨ìŒ","url":"/posts/tip/shortcut/"}]},{"title":"ë””ê¹…","type":"tag","url":"/tags/ë””ê¹…/","items":[{"title":"ëª¨ë…¸ë ˆí¬ì—ì„œ ì„œë¡œ ë‹¤ë¥¸ React ë²„ì „ ì‚¬ìš©ì‹œ ì—ëŸ¬","url":"/posts/error/ëª¨ë…¸ë ˆí¬ì—ì„œ ì„œë¡œ ë‹¤ë¥¸ react ë²„ì „ ì‚¬ìš©ì‹œ ì—ëŸ¬/"}]},{"title":"ì„±ëŠ¥ìµœì í™”","type":"tag","url":"/tags/ì„±ëŠ¥ìµœì í™”/","items":[{"title":"í”„ë¡ íŠ¸ì—”ë“œ ì„±ëŠ¥ ìµœì í™” íŒ ê¸°ë¡","url":"/posts/frontend/performance-tip/"}]},{"title":"ì˜¤ë¸Œì íŠ¸","type":"tag","url":"/tags/ì˜¤ë¸Œì íŠ¸/","items":[{"title":"ì˜¤íŠ¸ì íŠ¸ 01 ê°ì²´, ì„¤ê³„","url":"/posts/books/object/ì˜¤ë¸Œì íŠ¸-01/"},{"title":"ì˜¤íŠ¸ì íŠ¸ 03 ì—­í• , ì±…ì„, í˜‘ë ¥","url":"/posts/books/object/ì˜¤ë¸Œì íŠ¸-03/"},{"title":"ì˜¤íŠ¸ì íŠ¸ 04 ì„¤ê³„ í’ˆì§ˆê³¼ íŠ¸ë ˆì´ë“œ ì˜¤í”„","url":"/posts/books/object/ì˜¤ë¸Œì íŠ¸-04/"},{"title":"ì˜¤íŠ¸ì íŠ¸ 06 ë©”ì‹œì§€ì™€ ì¸í„°í˜ì´ìŠ¤","url":"/posts/books/object/ì˜¤ë¸Œì íŠ¸-06/"},{"title":"ì˜¤íŠ¸ì íŠ¸ 05 ì±…ì„ í• ë‹¹í•˜ê¸°","url":"/posts/books/object/ì˜¤ë¸Œì íŠ¸-05/"},{"title":"ì˜¤íŠ¸ì íŠ¸ 02 ê°ì²´ì§€í–¥ í”„ë¡œê·¸ë˜ë°","url":"/posts/books/object/ì˜¤ë¸Œì íŠ¸-02/"}]},{"title":"ì •ê·œì–¸ì–´","type":"tag","url":"/tags/ì •ê·œì–¸ì–´/","items":[{"title":"ì •ê·œì–¸ì–´","url":"/posts/regex/regular-language/"}]},{"title":"ì •ê·œí‘œí˜„ì‹","type":"tag","url":"/tags/ì •ê·œí‘œí˜„ì‹/","items":[{"title":"ì •ê·œí‘œí˜„ì‹ - 01. ì…ë¬¸ ì •ê·œí‘œí˜„ì‹","url":"/posts/regex/regex_01/"},{"title":"ì •ê·œí‘œí˜„ì‹ - 03. í”„ë¡œê·¸ë˜ë¨¸ë¥¼ ìœ„í•œ ê³ ê¸‰ ì •ê·œí‘œí˜„ì‹","url":"/posts/regex/regex_03/"},{"title":"ì •ê·œí‘œí˜„ì‹ - 02. ì •ê·œí‘œí˜„ì‹ì˜ ì—­ì‚¬","url":"/posts/regex/regex_02/"}]},{"title":"í”Œë ˆì´ì–´","type":"tag","url":"/tags/í”Œë ˆì´ì–´/","items":[{"title":"ì›¹ì—ì„œ\bì˜ìƒ ì¬ìƒì„ í•˜ê¸° ìœ„í•œ ì£¼ë³€ ì§€ì‹","url":"/posts/web/video player/"}]}]}],"tagsGroups":[{"title":"Readme","type":"tag","url":"/tags/readme/","items":[{"title":"ğŸ“ r0k Wiki","url":"/"}]},{"title":"Sentry","type":"tag","url":"/tags/sentry/","items":[{"title":"Sentry","url":"/posts/monitoring/sentry/"}]},{"title":"Web API","type":"tag","url":"/tags/web-api/","items":[{"title":"Blob","url":"/Web_API/Blob/"},{"title":"DOMMatrixReadOnly","url":"/Web_API/DOMMatrixReadOnly/"}]},{"title":"chatgpt","type":"tag","url":"/tags/chatgpt/","items":[{"title":"í˜¼ì ì•Œê¸° ì•„ê¹Œìš´ chatgpt í™œìš© ê¿€íŒ","url":"/posts/tip/chatgpt/"}]},{"title":"cloudflare","type":"tag","url":"/tags/cloudflare/","items":[{"title":"github ë¸”ë¡œê·¸ì— ë„ë©”ì¸ ì—°ê²°í•˜ê¸° by cloudflare","url":"/posts/cloud/cloudflare/my-dns/"}]},{"title":"git","type":"tag","url":"/tags/git/","items":[{"title":"git ë”¥ë‹¤ì´ë¸Œ - git merge, rebase","url":"/posts/study/codesoom-git/git-deep-dive-02/"},{"title":"git ë”¥ë‹¤ì´ë¸Œ - git branch, tag, HEAD","url":"/posts/study/codesoom-git/git-deep-dive-01/"},{"title":"git ë”¥ë‹¤ì´ë¸Œ - history","url":"/posts/study/codesoom-git/git-deep-dive-03/"}]},{"title":"javascript","type":"tag","url":"/tags/javascript/","items":[{"title":"callbackë¶€í„° async awaitê¹Œì§€ - Javascript ë¹„ë™ê¸°","url":"/posts/javascript/asynchronous/"},{"title":"ìë°”ìŠ¤í¬ë¦½íŠ¸ ë°ë“œ ì½”ë“œ ì œê±°","url":"/posts/javascript/ìë°”ìŠ¤í¬ë¦½íŠ¸ ë°ë“œ ì½”ë“œ ì œê±°/"},{"title":"ì›¹íŒ©ì„ ì“°ëŠ” ì´ìœ ì™€ ì‚¬ìš©ë²• ì •ë¦¬","url":"/posts/javascript/webpack/"},{"title":"í”„ë¡ íŠ¸ì—”ë“œ ì„±ëŠ¥ ìµœì í™” íŒ ê¸°ë¡","url":"/posts/frontend/performance-tip/"},{"title":"ì›¹ì—ì„œ\bì˜ìƒ ì¬ìƒì„ í•˜ê¸° ìœ„í•œ ì£¼ë³€ ì§€ì‹","url":"/posts/web/video player/"}]},{"title":"my-setting","type":"tag","url":"/tags/my-setting/","items":[{"title":"ë‚´ ê°œë°œ í™˜ê²½ ì„¸íŒ… ê¸°ë¡","url":"/posts/my-setting/"}]},{"title":"react-query","type":"tag","url":"/tags/react-query/","items":[{"title":"react-query ë™ì‘ ì•ˆí•˜ëŠ” ì´ìŠˆ í•´ê²°","url":"/posts/library/react-query/fail-request/"}]},{"title":"tip","type":"tag","url":"/tags/tip/","items":[{"title":"ë‚´ê°€ ì¨ë¨¹ìœ¼ë ¤ê³  ì •ë¦¬í•œ ë‹¨ì¶•í‚¤ & ëª…ë ¹ì–´ ëª¨ìŒ","url":"/posts/tip/shortcut/"},{"title":"webstorm ì‚¬ìš© íŒ","url":"/posts/tip/webstorm/"},{"title":"ë‚˜ë§Œì˜ ì—…ë¬´ ìŠµê´€ ì •ë¦¬","url":"/posts/tip/ë‚˜ë§Œì˜ ì—…ë¬´ ìŠµê´€ ì •ë¦¬/"},{"title":"í‚¤ë³´ë“œ ì•ˆì“°ê¸°","url":"/posts/tip/í‚¤ë³´ë“œ ì•ˆì“°ê¸°/"}]},{"title":"webstorm","type":"tag","url":"/tags/webstorm/","items":[{"title":"webstorm ì‚¬ìš© íŒ","url":"/posts/tip/webstorm/"}]},{"title":"ê°œì„ ","type":"tag","url":"/tags/ê°œì„ /","items":[{"title":"ìë°”ìŠ¤í¬ë¦½íŠ¸ ë°ë“œ ì½”ë“œ ì œê±°","url":"/posts/javascript/ìë°”ìŠ¤í¬ë¦½íŠ¸ ë°ë“œ ì½”ë“œ ì œê±°/"},{"title":"eslintì—ì„œ biomeë¡œ","url":"/posts/library/biome/"},{"title":"ë ˆê±°ì‹œë¥¼ ë” ë‚˜ì€ í™˜ê²½ìœ¼ë¡œ ë§Œë“¤ê¸°","url":"/posts/tip/ë ˆê±°ì‹œë¥¼ ë” ë‚˜ì€ í™˜ê²½ìœ¼ë¡œ ë§Œë“¤ê¸°/"}]},{"title":"ë‹¨ì¶•í‚¤","type":"tag","url":"/tags/ë‹¨ì¶•í‚¤/","items":[{"title":"ë‚´ê°€ ì¨ë¨¹ìœ¼ë ¤ê³  ì •ë¦¬í•œ ë‹¨ì¶•í‚¤ & ëª…ë ¹ì–´ ëª¨ìŒ","url":"/posts/tip/shortcut/"}]},{"title":"ë””ê¹…","type":"tag","url":"/tags/ë””ê¹…/","items":[{"title":"ëª¨ë…¸ë ˆí¬ì—ì„œ ì„œë¡œ ë‹¤ë¥¸ React ë²„ì „ ì‚¬ìš©ì‹œ ì—ëŸ¬","url":"/posts/error/ëª¨ë…¸ë ˆí¬ì—ì„œ ì„œë¡œ ë‹¤ë¥¸ react ë²„ì „ ì‚¬ìš©ì‹œ ì—ëŸ¬/"}]},{"title":"ì„±ëŠ¥ìµœì í™”","type":"tag","url":"/tags/ì„±ëŠ¥ìµœì í™”/","items":[{"title":"í”„ë¡ íŠ¸ì—”ë“œ ì„±ëŠ¥ ìµœì í™” íŒ ê¸°ë¡","url":"/posts/frontend/performance-tip/"}]},{"title":"ì˜¤ë¸Œì íŠ¸","type":"tag","url":"/tags/ì˜¤ë¸Œì íŠ¸/","items":[{"title":"ì˜¤íŠ¸ì íŠ¸ 01 ê°ì²´, ì„¤ê³„","url":"/posts/books/object/ì˜¤ë¸Œì íŠ¸-01/"},{"title":"ì˜¤íŠ¸ì íŠ¸ 03 ì—­í• , ì±…ì„, í˜‘ë ¥","url":"/posts/books/object/ì˜¤ë¸Œì íŠ¸-03/"},{"title":"ì˜¤íŠ¸ì íŠ¸ 04 ì„¤ê³„ í’ˆì§ˆê³¼ íŠ¸ë ˆì´ë“œ ì˜¤í”„","url":"/posts/books/object/ì˜¤ë¸Œì íŠ¸-04/"},{"title":"ì˜¤íŠ¸ì íŠ¸ 06 ë©”ì‹œì§€ì™€ ì¸í„°í˜ì´ìŠ¤","url":"/posts/books/object/ì˜¤ë¸Œì íŠ¸-06/"},{"title":"ì˜¤íŠ¸ì íŠ¸ 05 ì±…ì„ í• ë‹¹í•˜ê¸°","url":"/posts/books/object/ì˜¤ë¸Œì íŠ¸-05/"},{"title":"ì˜¤íŠ¸ì íŠ¸ 02 ê°ì²´ì§€í–¥ í”„ë¡œê·¸ë˜ë°","url":"/posts/books/object/ì˜¤ë¸Œì íŠ¸-02/"}]},{"title":"ì •ê·œì–¸ì–´","type":"tag","url":"/tags/ì •ê·œì–¸ì–´/","items":[{"title":"ì •ê·œì–¸ì–´","url":"/posts/regex/regular-language/"}]},{"title":"ì •ê·œí‘œí˜„ì‹","type":"tag","url":"/tags/ì •ê·œí‘œí˜„ì‹/","items":[{"title":"ì •ê·œí‘œí˜„ì‹ - 01. ì…ë¬¸ ì •ê·œí‘œí˜„ì‹","url":"/posts/regex/regex_01/"},{"title":"ì •ê·œí‘œí˜„ì‹ - 03. í”„ë¡œê·¸ë˜ë¨¸ë¥¼ ìœ„í•œ ê³ ê¸‰ ì •ê·œí‘œí˜„ì‹","url":"/posts/regex/regex_03/"},{"title":"ì •ê·œí‘œí˜„ì‹ - 02. ì •ê·œí‘œí˜„ì‹ì˜ ì—­ì‚¬","url":"/posts/regex/regex_02/"}]},{"title":"í”Œë ˆì´ì–´","type":"tag","url":"/tags/í”Œë ˆì´ì–´/","items":[{"title":"ì›¹ì—ì„œ\bì˜ìƒ ì¬ìƒì„ í•˜ê¸° ìœ„í•œ ì£¼ë³€ ì§€ì‹","url":"/posts/web/video player/"}]}]}},
    "staticQueryHashes": ["2320115945","2650345336","3495835395","451533639"]}